{
  "as_of": "2026-08-06T11:02:00+08:00",
  "cost_basis_policy": {
    "broker_display_cost": "DISPLAY_ONLY_NOT_ECONOMIC_COST_OVERRIDE",
    "economic_cash_cost": "TRACK_BY_PROGRAM_AND_TRANCHE",
    "prohibited_override": "BROKER_DISPLAY_UNIT_COST_32_55_MUST_NOT_REPLACE_ECONOMIC_CASH_COST",
    "tax_basis": "PENDING_TAX_DOCUMENTATION",
    "taxes_and_fees": "SEPARATE_PENDING_DOCUMENTATION"
  },
  "current_recognition": {
    "ordinary_share_position": {
      "available_quantity": 9900,
      "batch_identity": "AGGREGATE_2026_STOCK_INCENTIVE_AND_OPTION_SETTLED",
      "broker_display_cost_basis": 327244.5,
      "broker_display_unit_cost": 33.055,
      "economic_cash_cost": 160330.5,
      "included_in_real_account_current": true,
      "market_price": 33.63,
      "market_value": 332937.0,
      "quantity": 9900
    },
    "pending_entitlement": {
      "included_in_real_account_current": false,
      "included_in_total_assets": false,
      "market_value": 0.0,
      "quantity": 0,
      "status": "NO_PENDING_2026_ENTITLEMENT_AFTER_SECOND_SETTLEMENT"
    },
    "technical_entitlement_codes": [
      {
        "asset_recognition": "TECHNICAL_RIGHT_ONLY_NOT_ADDITIONAL_ASSET",
        "code": "Q99460",
        "display_quantity": 4950,
        "market_value": 0.0
      },
      {
        "asset_recognition": "TECHNICAL_RIGHT_ONLY_NOT_ADDITIONAL_ASSET",
        "code": "Q99461",
        "display_quantity": 4950,
        "market_value": 0.0
      }
    ]
  },
  "double_counting_controls": [
    "CURRENT_ORDINARY_SHARE_QUANTITY_MUST_EQUAL_9900",
    "PENDING_ENTITLEMENT_MUST_EQUAL_ZERO_AFTER_SECOND_SETTLEMENT",
    "Q99460_AND_Q99461_MUST_NOT_ENTER_ORDINARY_HOLDINGS",
    "2025_SOLD_13200_SHARES_MUST_NOT_REENTER_CURRENT_HOLDINGS",
    "BROKER_DISPLAY_COST_MUST_NOT_REPLACE_2026_ECONOMIC_CASH_COST_160330_50"
  ],
  "historical_closed_batches": [
    {
      "cash_economic_cost": 218064.0,
      "closure_status": "FULLY_SOLD_DO_NOT_REINTRODUCE",
      "current_position_quantity": 0,
      "option_exercise_quantity": 6600,
      "pre_tax_pre_fee_gross_profit": 160783.78,
      "sale_proceeds": 378847.78,
      "stock_incentive_quantity": 6600,
      "total_sold_quantity": 13200,
      "year": 2025
    }
  ],
  "issuer": {
    "canonical_security_id": "605090.SH",
    "exchange": "SSE",
    "name": "九丰能源",
    "security_code": "605090"
  },
  "orders": 0,
  "programs": [
    {
      "initial_cash_payment": {
        "amount": 217305.0,
        "paid_at": "2024-06",
        "unit_price": 13.17
      },
      "program_type": "STOCK_INCENTIVE",
      "total_quantity": 16500,
      "tranches": [
        {
          "current_position_quantity": 0,
          "economic_cash_cost": 86922.0,
          "quantity": 6600,
          "status": "SETTLED_AND_SOLD",
          "year": 2025
        },
        {
          "current_position_quantity": 4950,
          "economic_cash_cost": 65191.5,
          "quantity": 4950,
          "status": "SETTLED_AS_ORDINARY_SHARES",
          "year": 2026
        },
        {
          "current_position_quantity": 0,
          "economic_cash_cost": 65191.5,
          "quantity": 4950,
          "status": "PREPAID_UNVESTED",
          "year": 2027
        }
      ],
      "vesting_schedule": {
        "2025": 0.4,
        "2026": 0.3,
        "2027": 0.3
      }
    },
    {
      "program_type": "STOCK_OPTION",
      "total_quantity": 16500,
      "tranches": [
        {
          "cash_payment": 131142.0,
          "current_position_quantity": 0,
          "exercise_price": 19.87,
          "quantity": 6600,
          "status": "EXERCISED_SETTLED_AND_SOLD",
          "year": 2025
        },
        {
          "cash_payment": 95139.0,
          "current_position_quantity": 4950,
          "exercise_price": 19.22,
          "quantity": 4950,
          "status": "SETTLED_AS_ORDINARY_SHARES",
          "taxes_and_fees_included": false,
          "year": 2026
        },
        {
          "cash_payment": 0.0,
          "current_position_quantity": 0,
          "exercise_price": null,
          "quantity": 4950,
          "status": "UNVESTED_UNEXERCISED",
          "year": 2027
        }
      ],
      "vesting_schedule": {
        "2025": 0.4,
        "2026": 0.3,
        "2027": 0.3
      }
    }
  ],
  "schema_version": "1.0.0",
  "snapshot_type": "USER_CONFIRMED_INTRADAY",
  "state_id": "EQUITY_COMPENSATION_CURRENT_20260806",
  "status": "CURRENT_2026_STOCK_INCENTIVE_AND_OPTION_BATCHES_SETTLED_TAX_FEES_PENDING",
  "trade_authority": "NONE",
  "unresolved_items": [
    {
      "item": "CONFIRM_2026_TAX_AND_FEES",
      "required_evidence": "TAX_AND_FEE_STATEMENT",
      "status": "OPEN"
    },
    {
      "item": "CONFIRM_TECHNICAL_CODE_DISPLAY_MAPPING",
      "required_evidence": "BROKER_CODE_MAPPING_OPTIONAL",
      "status": "OPEN_NON_ASSET"
    }
  ]
}
